{
  "formatVersion": "2.0.0",
  "recordCompatibility": {
    "recordFormat": "2.0.0",
    "minimumReadableRecordFormat": "1.0.0",
    "note": "New flight metadata is additive; tasting records from format 1.0.0 remain readable as prior runs."
  },
  "id": "name-the-thing-match-the-mode-keep-one-truth",
  "title": "Name the thing, match the mode, keep one truth",
  "family": "Name the thing, match the mode, keep one truth",
  "summary": "Use the right ontology and authority map, then change modes only when invited.",
  "whyItExists": "Tests corrections that alter the world model, ideation without execution, and durable status that can hold mixed outcomes.",
  "evidenceBasis": {
    "grade": "strong-recurring",
    "types": [
      "expressed-preference-correction",
      "observed-model-encounter",
      "continued-accepted-artifact"
    ],
    "evidenceIds": [
      "MC057",
      "MC062",
      "MC072",
      "MCL062"
    ],
    "provenanceCaution": "All architectures and histories are fictional and closed.",
    "claimBoundary": "response-preference"
  },
  "effortEstimate": {
    "label": "medium",
    "minutes": 27
  },
  "version": "2.0.0",
  "status": "ready",
  "setup": {
    "context": "No tool use or file mutation is authorized in this flight.",
    "assets": []
  },
  "dishes": [
    {
      "id": "chats-are-cards",
      "title": "The chats are the cards",
      "summary": "Correct an invented task layer in a spatial conversation board.",
      "activityMode": "semantic-framing",
      "whyItExists": "Tests downstream ontology repair rather than a vocabulary-only correction.",
      "evidenceBasis": {
        "grade": "strong-recurring",
        "types": [
          "expressed-preference-correction",
          "observed-model-encounter"
        ],
        "evidenceIds": [
          "MCL001",
          "MCL055",
          "MCL062",
          "MC072"
        ],
        "provenanceCaution": "The session model and board are synthetic.",
        "claimBoundary": "response-preference"
      },
      "effortEstimate": {
        "label": "medium",
        "minutes": 11
      },
      "version": "2.0.0",
      "status": "ready",
      "setup": {
        "context": "The lifecycle field is canonical.",
        "assets": []
      },
      "harness": {
        "mode": "none",
        "mechanics": [],
        "separationNote": "This is architecture reasoning only."
      },
      "turns": [
        {
          "id": "board-brief",
          "kind": "prompt",
          "stage": "explore",
          "label": "Recommend an architecture",
          "prompt": "A fictional product has sessions with fields `id`, `title`, `lifecycle` (open, paused, complete), and `position`. A spatial board arranges these sessions. Recommend an architecture for the board and its lifecycle display."
        },
        {
          "id": "ontology-correction",
          "kind": "correction",
          "stage": "explore",
          "label": "Correct the object",
          "prompt": "Correction to carry forward: do not add task cards. The conversations themselves are the cards arranged spatially; lifecycle already belongs to each conversation."
        }
      ],
      "observationLenses": [
        "Whether parallel state disappears after correction.",
        "Whether canonical lifecycle remains attached to the right object.",
        "Whether affected architecture changes rather than only terminology."
      ],
      "repeatVariationGuidance": "Swap the domain object and tempting duplicate layer while retaining a canonical lifecycle field.",
      "externalCorrectnessChecks": [
        {
          "kind": "deterministic",
          "title": "State-surface review",
          "method": "Compare the proposal against the supplied model and reject duplicated lifecycle or task-card state."
        }
      ],
      "interactionRequirements": {
        "visualOrInteraction": false,
        "reducedMotionCheck": "not-applicable"
      },
      "humanJudgmentRequired": false
    },
    {
      "id": "brainstorm-do-not-build",
      "title": "Brainstorm, do not build",
      "summary": "Explore a rich concept without treating detail as permission to execute.",
      "activityMode": "semantic-framing",
      "whyItExists": "Tests clear ideation mode and load-bearing questions only.",
      "evidenceBasis": {
        "grade": "strong-recurring",
        "types": [
          "expressed-preference-correction",
          "observed-model-encounter"
        ],
        "evidenceIds": [
          "MC020",
          "MC034",
          "MC085",
          "CJ030"
        ],
        "provenanceCaution": "The concept and implementation detail are fictional; no actual files exist.",
        "claimBoundary": "response-preference"
      },
      "effortEstimate": {
        "label": "short",
        "minutes": 9
      },
      "version": "2.0.0",
      "status": "ready",
      "setup": {
        "context": "A response must not claim to edit, build, or launch anything.",
        "assets": []
      },
      "harness": {
        "mode": "none",
        "mechanics": [],
        "separationNote": "No execution harness is present."
      },
      "turns": [
        {
          "id": "concept",
          "kind": "prompt",
          "stage": "explore",
          "label": "Explore only",
          "prompt": "I am imagining a fictional neighborhood archive where walking routes reveal stories attached to street corners. It might have a map, a listening mode, and small paper-like traces. I am tempted to use a 3D engine, but I am not asking you to build or change files. Help me explore what the object could be and ask only questions that materially change the concept."
        },
        {
          "id": "metaphor-narrowing",
          "kind": "correction",
          "stage": "explore",
          "label": "Narrow the metaphor",
          "prompt": "Constraint for continued brainstorming: keep the route idea, but do not make the archive a game."
        }
      ],
      "observationLenses": [
        "Whether it remains in ideation.",
        "Whether questions are load-bearing rather than exhaustive.",
        "Whether a mechanism and a metaphor do not harden into requirements."
      ],
      "repeatVariationGuidance": "Use another rich fictional concept with one tempting implementation detail and an explicit no-build boundary.",
      "externalCorrectnessChecks": [
        {
          "kind": "deterministic",
          "title": "No-execution check",
          "method": "Inspect the response for implementation claims, tool actions, or implied file changes."
        },
        {
          "kind": "human",
          "title": "Concept review",
          "method": "Judge whether the exploration opens meaningful options without manufacturing scope."
        }
      ],
      "interactionRequirements": {
        "visualOrInteraction": false,
        "reducedMotionCheck": "not-applicable"
      },
      "humanJudgmentRequired": true
    },
    {
      "id": "useful-work-canceled-proposal",
      "title": "Useful work, canceled proposal",
      "summary": "Report a project history where one operation succeeded and a broader proposal was abandoned.",
      "activityMode": "semantic-framing",
      "whyItExists": "Tests a status update that preserves two truths and stays resumable.",
      "evidenceBasis": {
        "grade": "strong-recurring",
        "types": [
          "observed-model-encounter",
          "continued-accepted-artifact"
        ],
        "evidenceIds": [
          "MC057",
          "MC062",
          "MC091",
          "AO044"
        ],
        "provenanceCaution": "The event history is a closed fictional record.",
        "claimBoundary": "response-preference"
      },
      "effortEstimate": {
        "label": "short",
        "minutes": 7
      },
      "version": "2.0.0",
      "status": "ready",
      "setup": {
        "context": "Do not infer motivation beyond events.",
        "assets": []
      },
      "harness": {
        "mode": "none",
        "mechanics": [],
        "separationNote": "No live status system is queried."
      },
      "turns": [
        {
          "id": "status",
          "kind": "prompt",
          "stage": "verify",
          "label": "Write one status update",
          "prompt": "A fictional work history says: disk relief completed and verified; a proposed storage migration was reviewed, then explicitly abandoned; one future question remains about archival retention. Write one concise status update for someone resuming later."
        }
      ],
      "observationLenses": [
        "Whether completed work and abandoned proposal are both retained.",
        "Whether the remaining question stays visible.",
        "Whether it avoids forcing one global status label."
      ],
      "repeatVariationGuidance": "Change the successful operation and abandoned proposal; retain one visible unresolved residue.",
      "externalCorrectnessChecks": [
        {
          "kind": "deterministic",
          "title": "Event-status rubric",
          "method": "Check that completed, abandoned, and unresolved facts all appear without contradiction."
        }
      ],
      "interactionRequirements": {
        "visualOrInteraction": false,
        "reducedMotionCheck": "not-applicable"
      },
      "humanJudgmentRequired": false
    }
  ]
}
